"","id","source","pmid","pmcid","doi","title","authorString","journalTitle","issue","journalVolume","pubYear","journalIssn","pageInfo","pubType","isOpenAccess","inEPMC","inPMC","hasPDF","hasBook","hasSuppl","citedByCount","hasReferences","hasTextMinedTerms","hasDbCrossReferences","hasLabsLinks","hasTMAccessionNumbers","firstIndexDate","firstPublicationDate"
"499","34090684","MED","34090684","PMC8172569","10.1016/j.identj.2021.04.002","A Review of Aerosol Generation Mitigation in International Dental Guidance.","Robertson C, Clarkson JE, Aceves-Martins M, Ramsay CR, Richards D, Colloc T, CoDER Working Group.","Int Dent J",NA,NA,"2021","0020-6539; 1875-595x; ",NA,"research-article; journal article","Y","Y","N","Y","N","Y",0,"Y","Y","N","Y","N","2021-06-07","2021-06-03"
"500","34815483","MED","34815483","PMC8609985","10.1038/s41415-021-3621-8","'You had to do something': prescribing antibiotics in Scotland during the COVID-19 pandemic restrictions and remobilisation.","Duncan EM, Goulao B, Clarkson J, Young L, Ramsay CR.","Br Dent J",NA,NA,"2021","0007-0610; 1476-5373; ",NA,"letter; journal article","Y","Y","N","Y","N","Y",0,"Y","Y","N","Y","N","2021-12-01","2021-11-23"
"501","34002923","MED","34002923","PMC8242542","10.1111/odi.13919","Prevalence of anosmia and ageusia symptoms among long-term effects of COVID-19.","Moraschini V, Reis D, Sacco R, Calasans-Maia MD.","Oral Dis",NA,NA,"2021","1354-523x; 1601-0825; ",NA,"brief-report; journal article","Y","Y","N","Y","N","Y",1,"Y","Y","N","Y","N","2021-05-19","2021-05-18"
"502","32591664","MED","32591664","PMC7317250","10.1038/s41432-020-0098-2","Are hydroxychloroquine and chloroquine effective in the treatment of SARS-COV-2 (COVID-19)?","Wright C, Ross C, Mc Goldrick N.","Evid Based Dent","2","21","2020","1462-0049; 1476-5446; ","64-65","comment; research-article; journal article","Y","Y","N","Y","N","N",5,"Y","Y","N","Y","N","2020-06-28","2020-06-01"
"503","32312584","MED","32312584","PMC7152882","10.1016/j.bjoms.2020.04.002","Operating during the COVID-19 pandemic: How to reduce medical error.","Ellis R, Hay-David AGC, Brennan PA.","Br J Oral Maxillofac Surg","5","58","2020","0266-4356; 1532-1940; ","577-580","research-article; journal article","Y","Y","N","Y","N","N",15,"Y","Y","N","Y","N","2020-04-24","2020-04-13"
"504","32367576","MED","32367576","PMC7267240","10.1111/omi.12289","Saliva is a non-negligible factor in the spread of COVID-19.","Li Y, Ren B, Peng X, Hu T, Li J, Gong T, Tang B, Xu X, Zhou X.","Mol Oral Microbiol","4","35","2020","2041-1006; 2041-1014; ","141-145","research support, non-u.s. gov't; research-article; review; journal article","Y","Y","N","Y","N","N",44,"Y","Y","N","Y","N","2020-05-06","2020-05-31"
"505","32651512","MED","32651512","PMC7348558","10.1038/s41415-020-1784-3","Safe use of paracetamol and high-dose NSAID analgesia in dentistry during the COVID-19 pandemic.","Crighton AJ, McCann CT, Todd EJ, Brown AJ.","Br Dent J","1","229","2020","0007-0610; 1476-5373; ","15-18","research-article; review; journal article","Y","Y","N","Y","N","N",2,"Y","Y","N","Y","N","2020-07-16","2020-07-01"
"506","32401942","MED","32401942","PMC7213779","10.1590/1678-7757-2020-0263","How psychosocial and economic impacts of COVID-19 pandemic can interfere on bruxism and temporomandibular disorders?","Almeida-Leite CM, Stuginski-Barbosa J, Conti PCR.","J Appl Oral Sci",NA,"28","2020","1678-7757; 1678-7765; ","e20200263","letter; journal article","Y","Y","N","Y","N","N",10,"Y","Y","N","Y","N","2020-05-15","2020-05-11"
"507","34145477","MED","34145477","PMC8212794","10.1007/s00784-021-04030-3","Effect of spray air settings of speed-increasing contra-angle handpieces on intrapulpal temperatures, drilling times, and coolant spray pattern.","Lempel E, Szalma J.","Clin Oral Investig",NA,NA,"2021","1432-6981; 1436-3771; ",NA,"research-article; journal article","Y","Y","N","Y","N","Y",0,"Y","Y","N","Y","N","2021-06-20","2021-06-18"
"508","34552211","MED","34552211","PMC8456399","10.1038/s41415-021-3405-1","The future of dentistry post-COVID-19: perspectives from Urgent Dental Care centre staff in England.","Witton R, Plessas A, Wheat H, Baines R, Delgado MB, Mills I, Paisi M.","Br Dent J",NA,NA,"2021","0007-0610; 1476-5373; ",NA,"research-article; journal article","Y","Y","N","Y","N","Y",0,"Y","Y","N","Y","N","2021-09-24","2021-09-20"
"509","32302529","MED","32302529","PMC7144600","10.1016/j.joms.2020.03.036","A Pinch of Prevention is Worth a Pound of Cure: Proactive Dentistry in the Wake of COVID-19.","Halepas S, Ferneini EM.","J Oral Maxillofac Surg","6","78","2020","0278-2391; 1531-5053; ","860-861","brief-report; journal article","Y","Y","N","Y","N","N",6,"Y","Y","N","Y","N","2020-04-19","2020-04-09"
"510","32405606","MED","32405606","PMC7219354","10.1016/j.jormas.2020.05.005","Influence of the containment on the epidemiology of maxillo-facial emergencies during the COVID-19 pandemic. Why no more cellulites of odontogenic origin?","Kün-Darbois JD, Kahn A, Corre P.","J Stomatol Oral Maxillofac Surg","4","121","2020","2468-8509; 2468-7855; ","467-468","comment; letter; journal article","Y","Y","N","Y","N","N",2,"Y","Y","N","Y","N","2020-05-15","2020-05-13"
"511","32162995","MED","32162995","PMC7140973","10.1177/0022034520914246","Coronavirus Disease 2019 (COVID-19): Emerging and Future Challenges for Dental and Oral Medicine.","Meng L, Hua F, Bian Z.","J Dent Res","5","99","2020","0022-0345; 1544-0591; ","481-487","research support, non-u.s. gov't; research-article; journal article","Y","Y","N","Y","N","N",415,"Y","Y","N","Y","N","2020-03-13","2020-03-12"
"512","32418763","MED","32418763","PMC7211666","10.1016/j.bjoms.2020.04.047","The preventive effect of hydrocolloid dressing to prevent facial pressure and facial marks during use of medical protective equipment in COVID-19 pandemic.","Del Castillo Pardo de Vera JL, Reina Alcalde S, Cebrian Carretero JL, Burgueño García M.","Br J Oral Maxillofac Surg","6","58","2020","0266-4356; 1532-1940; ","723-725","brief-report; journal article","Y","Y","N","Y","N","N",4,"Y","Y","N","Y","N","2020-05-18","2020-05-11"
"513","34210281","MED","34210281","PMC8248759","10.1186/s12903-021-01674-1","CariesCare International adapted for the pandemic in children: Caries OUT multicentre single-group interventional study protocol.","Martignon S, Cortes A, Douglas GVA, Newton JT, Pitts NB, Avila V, Usuga-Vacca M, Gamboa LF, Deery C, Abreu-Placeres N, Bonifacio C, Braga MM, Carletto-Körber F, Castro P, P Cerezo M, Chavarría N, Cifuentes OL, Echeverri B, Jácome-Liévano S, Kuzmina I, Lara JS, Manton D, Martínez-Mier EA, Melo P, Muller-Bolla M, Ochoa E, Osorio JR, Ramos K, Sanabria AF, Sanjuán J, San-Martín M, Squassi A, Velasco AK, Villena R, Zandona AF, Beltrán EO.","BMC Oral Health","1","21","2021","1472-6831","329","research support, non-u.s. gov't; research-article; journal article","Y","Y","N","Y","N","Y",2,"Y","Y","N","Y","Y","2021-07-03","2021-07-01"
"514","32900674","MED","32900674","PMC7395630","10.1016/j.ejwf.2020.07.004","Impact of delayed orthodontic care during COVID-19 pandemic: Emergency, disability, and pain.","Turkistani KA.","J World Fed Orthod","3","9","2020","2212-4438","106-111","research-article; journal article","Y","Y","N","Y","N","N",4,"Y","Y","N","Y","N","2020-09-10","2020-08-01"
"515","32392364","MED","32392364","PMC7273100","10.1111/odi.13406","Political polarization at the time of the coronavirus: A Brazilian's view.","Leão JC.","Oral Dis",NA,"27 Suppl 3","2021","1354-523x; 1601-0825; ","713-715","brief-report; journal article","Y","Y","N","Y","N","N",1,"Y","Y","N","Y","N","2020-05-12","2020-05-25"
"516","34046944","MED","34046944","PMC8242462","10.1111/ipd.12843","Lockdown impact on lifestyle and its association with oral parafunctional habits and bruxism in a Spanish adolescent population.","Carrillo-Diaz M, Ortega-Martínez AR, Romero-Maroto M, González-Olmo MJ.","Int J Paediatr Dent",NA,NA,"2021","0960-7439; 1365-263x; ",NA,"research-article; journal article","Y","Y","N","Y","N","N",1,"Y","Y","N","N","N","2021-05-29","2021-05-28"
"517","32591701","MED","32591701","PMC7319222","10.1038/s41415-020-1705-5","Could we have prevented all this? A comparison of the British and South Korean primary dental care response to COVID-19.","Noh K, Loke J, Kim K.","Br Dent J","12","228","2020","0007-0610; 1476-5373; ","916-918","research-article; journal article","Y","Y","N","Y","N","N",1,"Y","Y","N","Y","N","2020-06-28","2020-06-01"
"518","32811723","MED","32811723","PMC7382926","10.1016/j.bjoms.2020.07.017","The impact of COVID-19 on cervicofacial infection of dental aetiology.","Politi I, McParland E, Smith R, Crummey S, Fan K.","Br J Oral Maxillofac Surg","8","58","2020","0266-4356; 1532-1940; ","1029-1033","research-article; journal article","Y","Y","N","Y","N","N",2,"Y","Y","N","Y","N","2020-08-20","2020-07-26"
"519","32614681","MED","32614681","PMC7444020","10.1177/0022034520940288","Modeling of the Transmission of Coronaviruses, Measles Virus, Influenza Virus, <i>Mycobacterium tuberculosis</i>, and <i>Legionella pneumophila</i> in Dental Clinics.","Zemouri C, Awad SF, Volgenant CMC, Crielaard W, Laheij AMGA, de Soet JJ.","J Dent Res","10","99","2020","0022-0345; 1544-0591; ","1192-1198","research support, non-u.s. gov't; research-article; journal article","Y","Y","N","Y","N","Y",21,"Y","Y","N","Y","N","2020-07-03","2020-07-02"
"520","32404268","MED","32404268","PMC7194067","10.1016/j.joms.2020.04.040","3D Printing of Face Shields During COVID-19 Pandemic: A Technical Note.","Amin D, Nguyen N, Roser SM, Abramowicz S.","J Oral Maxillofac Surg","8","78","2020","0278-2391; 1531-5053; ","1275-1278","research-article; journal article","Y","Y","N","Y","N","N",17,"Y","Y","N","Y","N","2020-05-15","2020-05-01"
"521","33208288","MED","33208288","PMC7435349","10.1016/j.bjoms.2020.08.065","The influence of 2020 coronavirus lockdown on presentation of oral and maxillofacial trauma to a central London hospital.","Yeung E, Brandsma DS, Karst FW, Smith C, Fan KFM.","Br J Oral Maxillofac Surg","1","59","2021","0266-4356; 1532-1940; ","102-105","research-article; journal article","Y","Y","N","Y","N","N",3,"N","Y","N","Y","N","2020-11-20","2020-08-19"
"522","32474996","MED","32474996","PMC7300710","10.1111/odi.13453","The life at the times of coronavirus: Microbes rule the world!","Meurman JH.","Oral Dis",NA,"27 Suppl 3","2021","1354-523x; 1601-0825; ","649-650","article-commentary; comment; journal article","Y","Y","N","Y","N","N",0,"N","Y","N","Y","N","2020-06-02","2020-06-22"
"523","34339619","MED","34339619","PMC8282937","10.1016/j.joms.2021.06.037","Analyzing the Effect of the COVID-19 Pandemic on the Oral and Maxillofacial Surgery Literature.","Warren VT, Thomas R, Boyd CJ, Hemal K, Ying YP.","J Oral Maxillofac Surg","12","79","2021","0278-2391; 1531-5053; ","2382-2384","discussion; journal article","Y","Y","N","Y","N","N",0,"Y","Y","N","Y","N","2021-08-03","2021-07-16"
"524","32954532","MED","32954532","PMC7537095","10.1002/jdd.12413","A nationwide survey of online teaching strategies in dental education in China.","Wang K, Zhang L, Ye L.","J Dent Educ","2","85","2021","0022-0337; 1930-7837; ","128-134","research-article; journal article","Y","Y","N","Y","N","N",14,"N","Y","N","Y","N","2020-09-23","2020-09-20"
"525","33479515","MED","33479515","PMC7819619","10.1038/s41415-020-2595-2","The effect of SARS-CoV-2 on the prescribing of antimicrobials and analgesics by NHS general dental practitioners in England.","Palmer NOA, Seoudi N.","Br Dent J",NA,NA,"2021","0007-0610; 1476-5373; ",NA,"research-article; journal article","Y","Y","N","Y","N","N",1,"Y","Y","N","Y","N","2021-01-23","2021-01-21"
"526","32349902","MED","32349902","PMC7151269","10.1016/j.bjoms.2020.03.024","Toward a consensus view in the management of acute facial injuries during the Covid-19 pandemic.","Holmes S, Bhatti N, Bhandari R, Chatzopoulou D.","Br J Oral Maxillofac Surg","5","58","2020","0266-4356; 1532-1940; ","571-576","research-article; journal article","Y","Y","N","Y","N","N",9,"Y","Y","N","Y","N","2020-05-05","2020-04-11"
"527","32127517","MED","32127517","PMC7054527","10.1038/s41368-020-0075-9","Transmission routes of 2019-nCoV and controls in dental practice.","Peng X, Xu X, Li Y, Cheng L, Zhou X, Ren B.","Int J Oral Sci","1","12","2020","1674-2818; 2049-3169; ","9","research support, non-u.s. gov't; review-article; review; journal article","Y","Y","N","Y","N","N",503,"Y","Y","N","Y","N","2020-03-05","2020-03-03"
"528","34148630","MED","34148630","PMC8103178","10.1016/j.identj.2021.04.004","The Impact of COVID-19 on Dentistry in Yichang, China, and Protective Suggestions for Normalisation of Epidemic Prevention.","Zhao S, Sun R, Yu H, Cao J, Zhang L.","Int Dent J",NA,NA,"2021","0020-6539; 1875-595x; ",NA,"research-article; journal article","Y","Y","N","Y","N","N",0,"Y","Y","N","Y","N","2021-06-22","2021-05-07"
"529","32304660","MED","32304660","PMC7195286","10.1016/j.joms.2020.04.016","The Role of Oral and Maxillofacial Surgeons in COVID-19 Response.","Patel NA, Ji YD, Odera SL.","J Oral Maxillofac Surg","7","78","2020","0278-2391; 1531-5053; ","1052-1053","brief-report; journal article","Y","Y","N","Y","N","N",3,"Y","Y","N","Y","N","2020-04-19","2020-04-14"
"530","32591702","MED","32591702","PMC7319204","10.1038/s41415-020-1781-6","The impact of the risk of COVID-19 on Black, Asian and Minority Ethnic (BAME) members of the UK dental profession.","Trivedy C, Mills I, Dhanoya O.","Br Dent J","12","228","2020","0007-0610; 1476-5373; ","919-922","research-article; journal article","Y","Y","N","Y","N","N",8,"Y","Y","N","Y","N","2020-06-28","2020-06-01"
"531","34446841","MED","34446841","PMC8390019","10.1038/s41415-021-3317-0","COVID-19 - the impact on wellbeing of the dental team in a secondary care urgent dental hub.","Sandhu BK, Blanchard JR, Koshal S.","Br Dent J",NA,NA,"2021","0007-0610; 1476-5373; ",NA,"research-article; journal article","Y","Y","N","Y","N","N",0,"Y","Y","N","Y","N","2021-08-28","2021-08-26"
"532","34511346","MED","34511346","PMC8127516","10.1016/j.oooo.2021.05.004","Management of pediatric facial fractures during COVID-19 pandemic.","Abramowicz S, Amin D, Goudy SL, Austin TM, Santore MT, Milder MJ, Roser SM.","Oral Surg Oral Med Oral Pathol Oral Radiol","5","132","2021","2212-4403; 2212-4411; ","e169-e174","research-article; journal article","Y","Y","N","Y","N","N",0,"Y","Y","N","Y","N","2021-09-15","2021-05-17"
"533","32094336","MED","32094336","PMC7039956","10.1038/s41368-020-0074-x","High expression of ACE2 receptor of 2019-nCoV on the epithelial cells of oral mucosa.","Xu H, Zhong L, Deng J, Peng J, Dan H, Zeng X, Li T, Chen Q.","Int J Oral Sci","1","12","2020","1674-2818; 2049-3169; ","8","research support, non-u.s. gov't; research-article; journal article","Y","Y","N","Y","N","N",854,"Y","Y","Y","Y","N","2020-02-26","2020-02-24"
"534","32576468","MED","32576468","PMC7303632","10.1016/j.bjoms.2020.06.012","Are you surgically current? Lessons from aviation for returning to non-urgent surgery following COVID-19.","Hardie JA, Brennan PA.","Br J Oral Maxillofac Surg","7","58","2020","0266-4356; 1532-1940; ","843-847","research-article; journal article","Y","Y","N","Y","N","N",3,"Y","Y","N","Y","N","2020-06-24","2020-06-19"
"535","32631754","MED","32631754","PMC7214297","10.1016/j.bjoms.2020.05.008","Setting up and maximising the usage of an Urgent Dental Care Centre in Blackpool. Sharing our experiences.","Hammond D, Hughes F, Stirrup P, Barkworth N.","Br J Oral Maxillofac Surg","7","58","2020","0266-4356; 1532-1940; ","834-837","research-article; journal article","Y","Y","N","Y","N","N",5,"Y","Y","N","Y","N","2020-07-08","2020-05-12"
"536","33845185","MED","33845185","PMC8032600","10.1016/j.jormas.2021.04.001","Low-risk clinic model in oral surgery clinic during COVID-19 pandemic.","Shen Y, Zhao JH, Cai Y, Wu Y.","J Stomatol Oral Maxillofac Surg",NA,NA,"2021","2468-8509; 2468-7855; ",NA,"research-article; journal article","Y","Y","N","Y","N","N",0,"Y","Y","N","Y","N","2021-04-13","2021-04-09"
"537","32966633","MED","32966633","PMC7537197","10.1111/joor.13098","Evaluating aerosol and splatter following dental procedures: Addressing new challenges for oral health care and rehabilitation.","Allison JR, Currie CC, Edwards DC, Bowes C, Coulter J, Pickering K, Kozhevnikova E, Durham J, Nile CJ, Jakubovics N, Rostami N, Holliday R.","J Oral Rehabil","1","48","2021","0305-182x; 1365-2842; ","61-72","research-article; journal article","Y","Y","N","Y","N","N",25,"N","Y","N","Y","N","2020-09-24","2020-10-08"
"538","32978579","MED","32978579","PMC7517749","10.1038/s41415-020-2114-5","Management of odontogenic infections and sepsis: an update.","Jevon P, Abdelrahman A, Pigadas N.","Br Dent J","6","229","2020","0007-0610; 1476-5373; ","363-370","research-article; journal article","Y","Y","N","Y","N","N",0,"Y","Y","N","Y","N","2020-09-27","2020-09-25"
"539","32389541","MED","32389541","PMC7194827","10.1016/j.joms.2020.04.034","Evolution of COVID-19 Guidelines for University of Washington Oral and Maxillofacial Surgery Patient Care.","Panesar K, Dodson T, Lynch J, Bryson-Cahn C, Chew L, Dillon J.","J Oral Maxillofac Surg","7","78","2020","0278-2391; 1531-5053; ","1136-1146","research support, non-u.s. gov't; research-article; journal article","Y","Y","N","Y","N","N",17,"Y","Y","N","Y","N","2020-05-12","2020-04-28"
"540","32473915","MED","32473915","PMC7255160","10.1016/j.joms.2020.05.029","Resident Education in the Time of a Global Pandemic: Development of the Collaborative OMS Virtual Interinstitutional Didactic (COVID) Program.","Moe J, Brookes C, Dyalram D, Kim R, Melville J, Quereshy F, Roser S, Salman S, Schlieve T, Steed M, Fisher E.","J Oral Maxillofac Surg","8","78","2020","0278-2391; 1531-5053; ","1224-1226","brief-report; journal article","Y","Y","N","Y","N","N",4,"Y","Y","N","Y","N","2020-06-02","2020-05-23"
"541","32479811","MED","32479811","PMC7246053","10.1016/j.joms.2020.05.027","Considerations for Oral and Maxillofacial Surgeons in COVID-19 Era: Can We Sustain the Solutions to Keep Our Patients and Healthcare Personnel Safe?","Chigurupati R, Panchal N, Henry AM, Batal H, Sethi A, D'innocenzo R, Mehra P, Krishnan DG, Roser SM.","J Oral Maxillofac Surg","8","78","2020","0278-2391; 1531-5053; ","1241-1256","review-article; review; journal article","Y","Y","N","Y","N","N",9,"Y","Y","N","Y","N","2020-06-02","2020-05-24"
"542","33263648","MED","33263648","PMC7714260","10.1590/1678-7757-2020-0445","Prevalence of symptoms of temporomandibular disorders, oral behaviors, anxiety, and depression in Dentistry students during the period of social isolation due to COVID-19.","Medeiros RA, Vieira DL, Silva EVFD, Rezende LVML, Santos RWD, Tabata LF.","J Appl Oral Sci",NA,"28","2020","1678-7757; 1678-7765; ","e20200445","research-article; journal article","Y","Y","N","Y","N","N",7,"N","Y","N","Y","N","2020-12-03","2020-11-30"
"543","33786650","MED","33786650","PMC8009636","10.1007/s00784-021-03917-5","Influence of COVID-19 pandemic on paediatric dental attendance.","Üstün N, Akgöl BB, Bayram M.","Clin Oral Investig","11","25","2021","1432-6981; 1436-3771; ","6185-6191","research-article; journal article","Y","Y","N","Y","N","N",1,"Y","Y","N","Y","N","2021-04-01","2021-03-30"
"544","32336398","MED","32336398","PMC7180017","10.1016/j.bjoms.2020.03.001","Precaution of 2019 novel coronavirus infection in department of oral and maxillofacial surgery.","Zhao Z, Gao D.","Br J Oral Maxillofac Surg","3","58","2020","0266-4356; 1532-1940; ","250-253","research-article; journal article","Y","Y","N","Y","N","N",11,"Y","Y","N","Y","N","2020-04-28","2020-04-01"
"545","32425296","MED","32425296","PMC7227514","10.1016/j.joms.2020.05.016","Opinion: An Increase in Severe, Late Dental Complications Might Result From Reliance on Home Dental Remedies During the COVID-19 Pandemic.","Yakubov D, Ward M, Ward B, Raymond GF, Paskhover B.","J Oral Maxillofac Surg","8","78","2020","0278-2391; 1531-5053; ","1232-1233","brief-report; journal article","Y","Y","N","Y","N","N",4,"N","Y","N","Y","N","2020-05-22","2020-05-15"
"546","34489544","MED","34489544","PMC8420962","10.1038/s41415-021-3375-3","Frontline experiences and perceptions of Urgent Dental Care centre staff in England during the COVID-19 pandemic: a qualitative study.","Plessas A, Paisi M, Baines R, Wheat H, Delgado MB, Mills I, Witton R.","Br Dent J",NA,NA,"2021","0007-0610; 1476-5373; ",NA,"research-article; journal article","Y","Y","N","Y","N","Y",2,"Y","Y","N","Y","N","2021-09-08","2021-09-06"
"547","33295831","MED","33295831","PMC7726624","10.1177/0022034520979830","Pandemic Considerations on Essential Oral Health Care.","Benzian H, Beltrán-Aguilar E, Mathur MR, Niederman R.","J Dent Res","3","100","2021","0022-0345; 1544-0591; ","221-225","research-article; journal article","Y","Y","N","Y","N","N",7,"N","Y","N","Y","N","2020-12-10","2020-12-09"
"548","32500586","MED","32500586","PMC7301023","10.1002/jdd.12236","Disruptions during a pandemic: Gaps identified and lessons learned.","Elangovan S, Mahrous A, Marchini L.","J Dent Educ","11","84","2020","0022-0337; 1930-7837; ","1270-1274","research-article; journal article","Y","Y","N","Y","N","N",12,"Y","Y","N","Y","N","2020-06-06","2020-06-04"
"549","34489546","MED","34489546","PMC8420960","10.1038/s41415-021-3379-z","Emergency dental care triage during the COVID-19 pandemic.","Ball M, Akintola D, Harrington Z, Djemal S.","Br Dent J",NA,NA,"2021","0007-0610; 1476-5373; ",NA,"research-article; journal article","Y","Y","N","Y","N","N",0,"N","Y","N","Y","N","2021-09-08","2021-09-06"
"550","32302530","MED","32302530","PMC7151518","10.1016/j.joms.2020.04.004","The UIC COVID Coverage Protocol: A Technical Note for Pandemic Oral and Maxillofacial Surgery Call Coverage.","Ebben S, Hussain RA, Miloro M, Callahan N.","J Oral Maxillofac Surg","7","78","2020","0278-2391; 1531-5053; ","1044-1046","brief-report; journal article","Y","Y","N","Y","N","N",4,"Y","Y","N","Y","N","2020-04-19","2020-04-10"
"551","34144788","MED","34144788","PMC8139262","10.1016/j.prosdent.2021.04.020","Comparative evaluation of bacterial colonization on removable dental prostheses in patients with COVID-19: A clinical study.","Karimzadeh F, Sajedi SM, Taram S, Karimzadeh F.","J Prosthet Dent",NA,NA,"2021","0022-3913; 1097-6841; ",NA,"research-article; journal article","Y","Y","N","Y","N","N",1,"Y","Y","N","Y","N","2021-06-20","2021-05-21"
"552","32488877","MED","32488877","PMC7300654","10.1002/jdd.12234","COVID-19: Finding silver linings for dental education.","Saeed SG, Bain J, Khoo E, Siqueira WL.","J Dent Educ","10","84","2020","0022-0337; 1930-7837; ","1060-1063","research-article; journal article","Y","Y","N","Y","N","N",12,"Y","Y","N","Y","N","2020-06-04","2020-06-02"
"553","32857641","MED","32857641","PMC7457005","10.1177/0022034520954126","Modeling the Impact of COVID-19 on Dental Insurance Coverage and Utilization.","Choi SE, Simon L, Riedy CA, Barrow JR.","J Dent Res","1","100","2021","0022-0345; 1544-0591; ","50-57","research-article; journal article","Y","Y","N","Y","N","Y",7,"Y","Y","N","Y","N","2020-08-29","2020-08-28"
"554","33127166","MED","33127166","PMC7556257","10.1016/j.bjoms.2020.09.037","Virtual ARCP assessment and trainee feedback meetings: facilitating the best experience and practice.","Oeppen RS, Rutherford E, Sadler P, Isaac R, Brennan PA.","Br J Oral Maxillofac Surg","10","58","2020","0266-4356; 1532-1940; ","1240-1244","review-article; review; journal article","Y","Y","N","Y","N","N",3,"Y","Y","N","Y","N","2020-10-31","2020-10-14"
"555","32591654","MED","32591654","PMC7317257","10.1038/s41432-020-0090-x","How can dentistry get back to work safely?","Madurantakam P.","Evid Based Dent","2","21","2020","1462-0049; 1476-5446; ","48","comment; research-article; journal article","Y","Y","N","Y","N","N",2,"Y","Y","N","N","N","2020-06-28","2020-06-01"
"556","32710053","MED","32710053","PMC7380139","10.1038/s41415-020-1854-6","The dental team as part of the medical workforce during national and global crises.","Sacoor S, Chana S, Fortune F.","Br Dent J","2","229","2020","0007-0610; 1476-5373; ","89-92","research-article; journal article","Y","Y","N","Y","N","N",3,"Y","Y","N","Y","N","2020-07-26","2020-07-01"
"557","32525056","MED","32525056","PMC7275999","10.1016/j.joen.2020.05.012","Development of a Device to Reduce Oropharyngeal Aerosol Transmission.","Russell C.","J Endod","8","46","2020","0099-2399; 1878-3554; ","1144-1148","brief-report; journal article","Y","Y","N","Y","N","N",4,"Y","Y","N","Y","N","2020-06-12","2020-06-07"
"558","34256956","MED","34256956","PMC7709721","10.1016/j.bjoms.2020.11.017","Surgical training during the COVID-19 pandemic: preparing for future uncertainty.","Ellis R, Scrimgeour DSG, Brennan PA.","Br J Oral Maxillofac Surg",NA,NA,"2020","0266-4356; 1532-1940; ",NA,"research-article; journal article","Y","Y","N","Y","N","N",0,"Y","Y","N","Y","N","2021-07-15","2020-12-02"
"559","32660877","MED","32660877","PMC7305874","10.1016/j.bjoms.2020.06.021","Coronavirus antibody positive tests and continued use of personal protective equipment throughout the pandemic.","Herron JBT, Dennis J, Brennan PA.","Br J Oral Maxillofac Surg","8","58","2020","0266-4356; 1532-1940; ","1014-1016","research-article; journal article","Y","Y","N","Y","N","N",2,"Y","Y","N","Y","N","2020-07-15","2020-06-20"
"560","33368603","MED","33368603","PMC8463922","10.1111/ger.12522","Acceptability of a community health worker intervention to improve the oral health of older Chinese Americans: A pilot study.","Northridge ME, Wu Y, Troxel AB, Min D, Liu R, Liang LJ, Metcalf SS, Seyedzadeh Sabounchi S, Yi S.","Gerodontology","1","38","2021","0734-0664; 1741-2358; ","117-122","research-article; journal article","N","Y","N","Y","N","N",0,"Y","Y","N","Y","N","2020-12-29","2020-12-27"
