"","id","source","pmid","pmcid","doi","title","authorString","journalTitle","issue","journalVolume","pubYear","journalIssn","pageInfo","pubType","isOpenAccess","inEPMC","inPMC","hasPDF","hasBook","hasSuppl","citedByCount","hasReferences","hasTextMinedTerms","hasDbCrossReferences","hasLabsLinks","hasTMAccessionNumbers","firstIndexDate","firstPublicationDate"
"121","33032593","MED","33032593","PMC7543039","10.1186/s12903-020-01270-9","COVID-19 transmission risk and protective protocols in dentistry: a systematic review.","Banakar M, Bagheri Lankarani K, Jafarpour D, Moayedi S, Banakar MH, MohammadSadeghi A.","BMC Oral Health","1","20","2020","1472-6831","275","research-article; systematic review; journal article","Y","Y","N","Y","N","N",29,"N","Y","N","Y","N","2020-10-16","2020-10-08"
"122","34320119","MED","34320119","PMC8315790","10.1590/1678-7757-2020-1089","Association of sleep quality and psychological aspects with reports of bruxism and TMD in Brazilian dentists during the COVID-19 pandemic.","Peixoto KO, Resende CMBM, Almeida EO, Almeida-Leite CM, Conti PCR, Barbosa GAS, Barbosa JS.","J Appl Oral Sci",NA,"29","2021","1678-7757; 1678-7765; ","e20201089","research-article; journal article","Y","Y","N","Y","N","N",1,"Y","Y","N","Y","N","2021-07-29","2021-07-23"
"123","34101037","MED","34101037","PMC8185310","10.1186/s40510-021-00363-7","Patients' perceptions of orthodontic treatment experiences during COVID-19: a cross-sectional study.","Arqub SA, Voldman R, Ahmida A, Kuo CL, Godoy LDC, Nasrawi Y, Al-Khateeb SN, Uribe F.","Prog Orthod","1","22","2021","1723-7785; 2196-1042; ","17","research-article; journal article","Y","Y","N","Y","N","N",0,"Y","Y","N","Y","N","2021-06-09","2021-06-08"
"124","33975613","MED","33975613","PMC8110692","10.1186/s13005-021-00267-1","COVID-19 and periodontitis: reflecting on a possible association.","Campisi G, Bizzoca ME, Lo Muzio L.","Head Face Med","1","17","2021","1746-160x","16","research-article; review; journal article","Y","Y","N","Y","N","N",3,"Y","Y","N","Y","N","2021-05-13","2021-05-11"
"125","33772784","MED","33772784","PMC8250841","10.1002/jdd.12597","COVID-19 pandemic and its impact on dental students: A multi-institutional survey.","Klaassen H, Ashida S, Comnick CL, Xie XJ, Smith BM, Tabrizi M, Arsenault K, Capin OR, Scully AC, da Mata C, Soto AP, Dias Ribeiro AP, Prince D, Christensen A, Giner-Tarrida L, Satorres Nieto M, León S, Gambetta-Tessini K, Santos MBF, Dias da Silva MA, Pereira AC, Dias do Carmo E, Aurora Stabile Gonnelli F, Carvalho FG, Collares K, Bervian J, Sarkis-Onofre R, Jerfeson Dos Santos Gonçalves F, Bueno-Silva B, Estela Haddad A, Gurgel BCV, Alves PM, Shigli K, Nayak SS, Nayak PP, Murugaboopathy V, Savitha PN, Murthy V, Deshpande S, Marchini L.","J Dent Educ","7","85","2021","0022-0337; 1930-7837; ","1280-1286","research-article; journal article","Y","Y","N","Y","N","Y",4,"Y","Y","N","Y","N","2021-03-28","2021-03-27"
"126","33129751","MED","33129751","PMC7561523","10.1016/j.joms.2020.10.015","Odontogenic Infections: Disease Burden During COVID-19 at a Single Institution.","Johnson RE, Foy TE, Ellingsen TA, Nelson JL, Dillon JK.","J Oral Maxillofac Surg","4","79","2021","0278-2391; 1531-5053; ","830-835","research-article; journal article","Y","Y","N","Y","N","Y",1,"Y","Y","N","Y","N","2020-11-02","2020-10-16"
"127","34020914","MED","34020914","PMC7869686","10.1016/j.oooo.2021.01.024","A cross-sectional survey of anxiety levels of oral and maxillofacial surgery residents during the early COVID-19 pandemic.","Amin D, Austin TM, Roser SM, Abramowicz S.","Oral Surg Oral Med Oral Pathol Oral Radiol","2","132","2021","2212-4403; 2212-4411; ","137-144","research-article; journal article","Y","Y","N","Y","N","N",0,"Y","Y","N","Y","N","2021-05-23","2021-02-08"
"128","33845828","MED","33845828","PMC8040365","10.1186/s12903-021-01547-7","Online dental teaching practices during the COVID-19 pandemic: a cross-sectional online survey from China.","Jiang Z, Zhu D, Li J, Ren L, Pu R, Yang G.","BMC Oral Health","1","21","2021","1472-6831","189","research support, non-u.s. gov't; research-article; journal article","Y","Y","N","Y","N","N",2,"Y","Y","N","Y","N","2021-04-14","2021-04-12"
"129","34310426","MED","34310426","PMC8549128","10.1097/scs.0000000000008018","Review of ""Short-Term Effects of Canceled Elective Procedures Due to COVID-19: Evidence From the Veterans Affairs Healthcare System"" by Tran LD, Rose L, Urech T. et al. Annals of Surgery 2021;274:45-49.","Mohan V, Hollier LH.","J Craniofac Surg","8","32","2021","1049-2275; 1536-3732; ","e841-e842","editorial; comment; journal article","Y","Y","N","Y","N","N",0,"N","Y","N","Y","N","2021-07-27","2021-11-01"
"130","32414539","MED","32414539","PMC7196423","10.1016/j.bjoms.2020.04.035","Impact of COVID-19 epidemic on maxillofacial surgery in Italy.","Allevi F, Dionisio A, Baciliero U, Balercia P, Beltramini GA, Bertossi D, Bozzetti A, Califano L, Cascone P, Colombo L, Copelli C, De Ponte FS, De Riu G, Della Monaca M, Fusetti S, Galié M, Giannì AB, Longo F, Mannucci N, Nocini PF, Pelo S, Ramieri G, Sesenna E, Solazzo L, Spinelli G, Tarsitano A, Tartaro G, Valentini V, Verrina G, Biglioli F.","Br J Oral Maxillofac Surg","6","58","2020","0266-4356; 1532-1940; ","692-697","research-article; journal article","Y","Y","N","Y","N","Y",20,"Y","Y","N","Y","N","2020-05-17","2020-05-03"
"131","34172909","MED","34172909","PMC8226354","10.1038/s41432-021-0182-2","Should we test asymptomatic children for SARS-CoV-2?","Cowan K, Keys W.","Evid Based Dent","2","22","2021","1462-0049; 1476-5446; ","64-65","comment; research-article; journal article","Y","Y","N","Y","N","N",0,"Y","Y","N","Y","N","2021-06-27","2021-01-01"
"132","33902535","MED","33902535","PMC8074701","10.1186/s12903-021-01577-1","Social determinants of seeking emergency and routine dental care in Saudi Arabia during the COVID-19 pandemic.","Meisha DE, Alsolami AM, Alharbi GM.","BMC Oral Health","1","21","2021","1472-6831","212","research-article; journal article","Y","Y","N","Y","N","Y",3,"Y","Y","N","Y","N","2021-04-28","2021-04-26"
"133","33538007","MED","33538007","PMC8014638","10.1002/jdd.12562","Impact of the COVID-19 pandemic on dental clinical training and future prospects.","Nishioka T, Mayanagi G, Iwamatsu-Kobayashi Y, Hong G.","J Dent Educ",NA,"85 Suppl 3","2021","0022-0337; 1930-7837; ","1999-2001","research-article; journal article","Y","Y","N","Y","N","N",1,"Y","Y","N","Y","N","2021-02-05","2021-02-03"
"134","34645423","MED","34645423","PMC8510883","10.1186/s12903-021-01871-y","Associations between psychological wellbeing, depression, general anxiety, perceived social support, tooth brushing frequency and oral ulcers among adults resident in Nigeria during the first wave of the COVID-19 pandemic.","Folayan MO, Ibigbami OI, Oloniniyi IO, Oginni O, Aloba O.","BMC Oral Health","1","21","2021","1472-6831","520","research-article; journal article","Y","Y","N","Y","N","N",0,"Y","Y","N","Y","N","2021-10-15","2021-10-13"
"135","32959382","MED","32959382","PMC7537088","10.1002/jdd.12423","Nigerian undergraduate dental students' knowledge, perception, and attitude to COVID-19 and infection control practices.","Umeizudike KA, Isiekwe IG, Fadeju AD, Akinboboye BO, Aladenika ET.","J Dent Educ","2","85","2021","0022-0337; 1930-7837; ","187-196","research-article; journal article","Y","Y","N","Y","N","N",8,"N","Y","N","Y","N","2020-09-23","2020-09-21"
"136","34181804","MED","34181804","PMC8447127","10.1111/odi.13951","Self-reported taste and smell impairment among patients diagnosed with COVID-19 in Brazil.","Silva FTD, Sperandio M, Suzuki SS, Silva HPV, de Oliveira DG, Stefenon L, Garcez AS.","Oral Dis",NA,NA,"2021","1354-523x; 1601-0825; ",NA,"brief-report; journal article","Y","Y","N","Y","N","N",1,"Y","Y","N","Y","N","2021-06-29","2021-06-28"
"137","34196047","MED","34196047","PMC8444665","10.1111/clr.13784","Summary of European guidelines on infection control and prevention during COVID-19 pandemic.","Becker K, Gurzawska-Comis K, Brunello G, Klinge B.","Clin Oral Implants Res",NA,"32 Suppl 21","2021","0905-7161; 1600-0501; ","353-381","research-article; review; journal article","Y","Y","N","Y","N","N",2,"N","Y","N","Y","N","2021-07-02","2021-10-01"
"138","32663338","MED","32663338","PMC7404936","10.1002/jdd.12302","COVID-19 pandemic: Students' perspectives on dental geriatric care and education.","Brondani M, Donnelly L.","J Dent Educ","11","84","2020","0022-0337; 1930-7837; ","1237-1244","research-article; journal article","Y","Y","N","Y","N","N",8,"Y","Y","N","Y","N","2020-07-16","2020-07-14"
"139","33685772","MED","33685772","PMC7883701","10.1016/j.bjoms.2021.02.002","Supraclavicular lymphadenopathy following COVID-19 vaccination: an increasing presentation to the two-week wait neck lump clinic?","Mitchell OR, Dave R, Bekker J, Brennan PA.","Br J Oral Maxillofac Surg","3","59","2021","0266-4356; 1532-1940; ","384-385","brief-report; journal article","Y","Y","N","Y","N","N",11,"Y","Y","N","Y","N","2021-03-11","2021-02-15"
"140","33825992","MED","33825992","PMC8024940","10.1186/s40510-021-00355-7","The perception of COVID-19 among Italian dental patients: an orthodontic point of view.","Martina S, Amato A, Faccioni P, Iandolo A, Amato M, Rongo R.","Prog Orthod","1","22","2021","1723-7785; 2196-1042; ","11","research-article; journal article","Y","Y","N","Y","N","N",0,"Y","Y","N","Y","N","2021-04-08","2021-04-07"
"141","33879144","MED","33879144","PMC8056369","10.1186/s12903-021-01564-6","Anxiety and facial self-contacts: possible impact on COVID-19 transmission in dental practice.","Carrillo-Diaz M, Lacomba-Trejo L, Del Valle-González A, Romero-Maroto M, González-Olmo MJ.","BMC Oral Health","1","21","2021","1472-6831","200","research-article; journal article","Y","Y","N","Y","N","Y",1,"Y","Y","N","Y","N","2021-04-22","2021-04-20"
"142","33840762","MED","33840762","PMC8162044","10.1097/scs.0000000000007658","Discussion of a Guide to Developing Safety Protocols for International Craniofacial Outreach Programs During the COVID-19 Era.","Akin J, Hamidian Jahromi A, Stoehr JR, Reynolds A, Gosain AK.","J Craniofac Surg","4","32","2021","1049-2275; 1536-3732; ","1554-1555","comment; research-article; journal article","Y","Y","N","Y","N","N",0,"Y","Y","N","Y","N","2021-04-13","2021-06-01"
"143","34565628","MED","34565628","PMC8405595","10.1016/j.ajodo.2021.08.010","Impact of COVID-19 pandemic on orthodontics in predoctoral and postdoctoral programs in the United States.","Vakili A, Chaffee BW, Oberoi S.","Am J Orthod Dentofacial Orthop",NA,NA,"2021","0889-5406; 1097-6752; ",NA,"research-article; journal article","Y","Y","N","Y","N","N",0,"Y","Y","N","Y","N","2021-09-28","2021-08-31"
"144","33427776","MED","33427776","PMC8386443","10.1097/scs.0000000000007412","Olfactory and Gustatory Dysfunctions in COVID-19 Patients: From a Different Perspective.","Polat B, Yilmaz NH, Altin G, Atakcan Z, Mert A.","J Craniofac Surg","6","32","2021","1049-2275; 1536-3732; ","2119-2122","research-article; journal article","Y","Y","N","Y","N","Y",1,"Y","Y","N","Y","N","2021-01-13","2021-09-01"
"145","34097864","MED","34097864","PMC8062423","10.1016/j.joms.2021.04.016","The Psychological Well-Being of Medical Versus Dental GME Residents During the COVID 19 Pandemic: A Cross-Sectional Study.","Bhalla N, Suneja N, Kobryn A, Lew S, Dym H.","J Oral Maxillofac Surg","9","79","2021","0278-2391; 1531-5053; ","1828.e1-1828.e8","research-article; journal article","Y","Y","N","Y","N","N",0,"Y","Y","N","Y","N","2021-06-08","2021-04-23"
"146","33015929","MED","33015929","PMC7675464","10.1111/eje.12608","Dental education in the time of SARS-CoV-2.","Sukumar S, Dracopoulos SA, Martin FE.","Eur J Dent Educ","2","25","2021","1396-5883; 1600-0579; ","325-331","research-article; review; journal article","Y","Y","N","Y","N","N",5,"N","Y","N","Y","N","2020-10-16","2020-10-15"
"147","34271846","MED","34271846","PMC8461046","10.1177/00220345211029638","Additive Effect of Periodontal Disease and Obesity on COVID-19 Outcomes.","Larvin H, Wilmott S, Kang J, Aggarwal VR, Pavitt S, Wu J.","J Dent Res","11","100","2021","0022-0345; 1544-0591; ","1228-1235","research support, non-u.s. gov't; research-article; journal article","Y","Y","N","Y","N","Y",1,"Y","Y","N","Y","N","2021-07-18","2021-07-16"
"148","33609022","MED","33609022","PMC8254882","10.4317/medoral.24424","Evaluation of saliva as a complementary technique to the diagnosis of COVID-19: a systematic review.","Sagredo-Olivares K, Morales-Gómez C, Aitken-Saavedra J.","Med Oral Patol Oral Cir Bucal","4","26","2021","1698-4447; 1698-6946; ","e526-e532","systematic review; review-article; journal article","Y","Y","N","Y","N","N",4,"Y","Y","N","Y","N","2021-02-21","2021-07-01"
"149","33632409","MED","33632409","PMC7832615","10.1016/j.adaj.2020.11.014","Oral manifestations of COVID-2019-related multisystem inflammatory syndrome in children: a review of 47 pediatric patients.","Halepas S, Lee KC, Myers A, Yoon RK, Chung W, Peters SM.","J Am Dent Assoc","3","152","2021","0002-8177; 1943-4723; ","202-208","research-article; review; journal article","Y","Y","N","Y","N","N",10,"Y","Y","N","Y","N","2021-02-27","2020-12-09"
"150","33638235","MED","33638235","PMC8013597","10.1002/jdd.12570","Impact of COVID-19 on advanced dental education: Perspectives of dental residents in Wuhan.","Zhao D, Yu J, Zhang T, Du M, Yang Q, Li Z, Fouad AF.","J Dent Educ","6","85","2021","0022-0337; 1930-7837; ","756-767","research-article; journal article","Y","Y","N","Y","N","N",2,"Y","Y","N","Y","N","2021-02-28","2021-02-26"
"151","33527378","MED","33527378","PMC8014679","10.1111/jcpe.13435","Association between periodontitis and severity of COVID-19 infection: A case-control study.","Marouf N, Cai W, Said KN, Daas H, Diab H, Chinta VR, Hssain AA, Nicolau B, Sanz M, Tamimi F.","J Clin Periodontol","4","48","2021","0303-6979; 1600-051x; ","483-491","research support, non-u.s. gov't; research-article; journal article","Y","Y","N","Y","N","Y",39,"Y","Y","N","Y","N","2021-02-03","2021-02-15"
"152","34196051","MED","34196051","PMC8444799","10.1111/clr.13783","Dental care during COVID-19 pandemic: Follow-up survey of experts' opinion.","Brunello G, Gurzawska-Comis K, Becker K, Becker J, Sivolella S, Schwarz F, Klinge B.","Clin Oral Implants Res",NA,"32 Suppl 21","2021","0905-7161; 1600-0501; ","342-352","research-article; review; journal article","Y","Y","N","Y","N","N",0,"N","Y","N","Y","N","2021-07-02","2021-10-01"
"153","33947605","MED","33947605","PMC8057932","10.1016/j.bjoms.2021.04.008","COVID-19 vaccination and low cervical lymphadenopathy in the two week neck lump clinic - a follow up audit.","Mitchell OR, Couzins M, Dave R, Bekker J, Brennan PA.","Br J Oral Maxillofac Surg","6","59","2021","0266-4356; 1532-1940; ","720-721","brief-report; journal article","Y","Y","N","Y","N","N",2,"Y","Y","N","Y","N","2021-05-06","2021-04-21"
"154","33962609","MED","33962609","PMC8102846","10.1186/s12903-021-01601-4","Dental practice closure during the first wave of COVID-19 and associated professional, practice and structural determinants: a multi-country survey.","Abdelrahman H, Atteya S, Ihab M, Nyan M, Maharani DA, Rahardjo A, Shaath M, Aboalshamat K, Butool S, Shamala A, Baig L, El Tantawi M.","BMC Oral Health","1","21","2021","1472-6831","243","research-article; journal article","Y","Y","N","Y","N","Y",2,"Y","Y","N","Y","N","2021-05-09","2021-05-07"
"155","33579540","MED","33579540","PMC7825947","10.1016/j.bjoms.2021.01.005","Orthognathic surgery in COVID-19 times, is it safe?","Glen P, Aurora F, Thomas S, Kissun D.","Br J Oral Maxillofac Surg","4","59","2021","0266-4356; 1532-1940; ","490-493","research-article; journal article","Y","Y","N","Y","N","N",1,"Y","Y","N","Y","N","2021-02-14","2021-01-22"
"156","32303420","MED","32303420","PMC7128256","10.1016/j.jcms.2020.03.011","Approaches to the management of patients in oral and maxillofacial surgery during COVID-19 pandemic.","Zimmermann M, Nkenke E.","J Craniomaxillofac Surg","5","48","2020","1010-5182; 1878-4119; ","521-526","review-article; review; journal article","Y","Y","N","Y","N","N",54,"Y","Y","N","Y","N","2020-04-19","2020-04-04"
"157","34016110","MED","34016110","PMC8135170","10.1186/s12903-021-01635-8","Tongue ulcer in a patient with COVID-19: a case presentation.","Nejabi MB, Noor NAS, Raufi N, Essar MY, Ehsan E, Shah J, Shah A, Nemat A.","BMC Oral Health","1","21","2021","1472-6831","273","journal article; case reports; case-report","Y","Y","N","Y","N","N",2,"Y","Y","N","Y","N","2021-05-22","2021-05-20"
"158","34376339","MED","34376339","PMC7867386","10.1016/j.ajodo.2020.12.016","Appointment impact and orthodontic emergency occurrence during the coronavirus disease 2019 pandemic: A retrospective study.","Xiang J, Xin Y, Wang R, Zhou H, Zou Y, Shim S, Zhao L.","Am J Orthod Dentofacial Orthop","1","161","2022","0889-5406; 1097-6752; ","e12-e19","research-article; journal article","Y","Y","N","Y","N","N",0,"Y","Y","N","Y","N","2021-08-12","2021-02-06"
"159","33964018","MED","33964018","PMC8242383","10.1002/jdd.12643","Development of an online tooth morphology course in response to COVID-19 restrictions.","Lone M, Mohamed MAA, Toulouse A.","J Dent Educ",NA,"85 Suppl 3","2021","0022-0337; 1930-7837; ","1946-1948","research-article; journal article","Y","Y","N","Y","N","Y",1,"Y","Y","N","Y","N","2021-05-09","2021-05-17"
"160","34034897","MED","34034897","PMC8141906","10.1016/j.prosdent.2021.03.022","Evaluation of quality of life and oral hygiene attitudes of individuals using dental prostheses during the COVID-19 pandemic.","Degirmenci K, Kalaycioglu O.","J Prosthet Dent","1","126","2021","0022-3913; 1097-6841; ","51.e1-51.e7","research-article; journal article","Y","Y","N","Y","N","N",0,"Y","Y","N","Y","N","2021-05-28","2021-05-24"
"161","33792422","MED","33792422","PMC8138328","10.1177/00220345211005782","Dental Pain and Worsened Socioeconomic Conditions Due to the COVID-19 Pandemic.","Matsuyama Y, Aida J, Takeuchi K, Koyama S, Tabuchi T.","J Dent Res","6","100","2021","0022-0345; 1544-0591; ","591-598","research support, non-u.s. gov't; research-article; journal article","Y","Y","N","Y","N","Y",4,"Y","Y","N","Y","N","2021-04-02","2021-04-01"
"162","34325779","MED","34325779","PMC7997726","10.1016/j.adaj.2021.03.007","Efficacy of personal protective equipment against coronavirus transmission via dental handpieces.","Ionescu AC, Brambilla E, Manzoli L, Orsini G, Gentili V, Rizzo R.","J Am Dent Assoc","8","152","2021","0002-8177; 1943-4723; ","631-640","research support, non-u.s. gov't; research-article; journal article","Y","Y","N","Y","N","N",0,"Y","Y","N","Y","N","2021-07-31","2021-03-26"
"163","33509030","MED","33509030","PMC7961632","10.1177/2380084421989946","The Debate: What Are Aerosol-Generating Procedures in Dentistry? A Rapid Review.","Virdi MK, Durman K, Deacon S.","JDR Clin Trans Res","2","6","2021","2380-0844; 2380-0852; ","115-127","review-article; review; journal article","Y","Y","N","Y","N","N",0,"Y","Y","N","Y","N","2021-01-30","2021-01-29"
"164","33448376","MED","33448376","PMC8013967","10.1002/jdd.12539","Use of Microsoft Teams private channels for in-person small group hands-on instruction during COVID-19 social distancing requirements.","Trowbridge T, McDaniel T, Shafi B, Copeland C.","J Dent Educ",NA,"85 Suppl 3","2021","0022-0337; 1930-7837; ","2030-2031","research-article; journal article","Y","Y","N","Y","N","N",1,"Y","Y","N","Y","N","2021-01-16","2021-01-27"
"165","33902341","MED","33902341","PMC8207488","10.1177/23800844211011985","Reopening Oral Health Services during the COVID-19 Pandemic through a Knowledge Exchange Coalition.","McNally M, Rock L, Gillis M, Bryan S, Boyd C, Kraglund F, Cleghorn B.","JDR Clin Trans Res","3","6","2021","2380-0844; 2380-0852; ","279-290","research support, non-u.s. gov't; research-article; journal article","Y","Y","N","Y","N","Y",1,"Y","Y","N","Y","N","2021-04-28","2021-04-27"
"166","34400252","MED","34400252","PMC8361006","10.1016/j.jdent.2021.103782","Patients' and dentists' perceptions of tele-dentistry at the time of COVID-19. A questionnaire-based study.","Menhadji P, Patel R, Asimakopoulou K, Quinn B, Khoshkhounejad G, Pasha P, Garcia Sanchez R, Ide M, Kalsi P, Nibali L.","J Dent",NA,"113","2021","0300-5712; 1879-176x; ","103782","research-article; journal article","Y","Y","N","Y","N","N",1,"Y","Y","N","Y","N","2021-08-18","2021-08-13"
"167","33448387","MED","33448387","PMC8014854","10.1002/jdd.12532","Comparison of in-person and remote pediatric dentistry lectures before and during the COVID-19 pandemic.","Nelson T, Nelson G, Rothen M, Kim A.","J Dent Educ",NA,"85 Suppl 3","2021","0022-0337; 1930-7837; ","1917-1919","research-article; journal article","Y","Y","N","Y","N","N",2,"Y","Y","N","Y","N","2021-01-16","2021-01-27"
"168","33771143","MED","33771143","PMC7994179","10.1186/s12903-021-01533-z","Impact of COVID-19 on the oral health of adults in Wuhan and China: results of a nationwide online cross-sectional questionnaire survey.","Zhang S, Liu C, Zhang C, Jiang H, Tai B, Du M.","BMC Oral Health","1","21","2021","1472-6831","162","research-article; journal article","Y","Y","N","Y","N","Y",0,"Y","Y","N","Y","N","2021-03-28","2021-03-26"
"169","33772953","MED","33772953","PMC8251452","10.1111/odi.13857","Oral manifestations accompanying and related to COVID-19: Overlooking the obvious.","Anaya-Saavedra G.","Oral Dis",NA,NA,"2021","1354-523x; 1601-0825; ",NA,"brief-report; journal article","Y","Y","N","Y","N","N",3,"Y","Y","N","Y","N","2021-03-28","2021-03-26"
"170","32428459","MED","32428459","PMC7215154","10.1016/j.joms.2020.05.007","Uncertainty and the Risk of Occupational Exposure to Severe Acute Respiratory Syndrome-Coronavirus-2.","Dodson TB.","J Oral Maxillofac Surg","8","78","2020","0278-2391; 1531-5053; ","1229-1231","brief-report; journal article","Y","Y","N","Y","N","N",1,"Y","Y","N","Y","N","2020-05-22","2020-05-12"
"171","33097885","MED","33097885","PMC7582419","10.1038/s41415-020-2228-9","Non-infectious status indicated by detectable IgG antibody to SARS-CoV-2.","Denning DW, Kilcoyne A, Ucer C.","Br Dent J","8","229","2020","0007-0610; 1476-5373; ","521-524","research support, non-u.s. gov't; research-article; journal article","Y","Y","N","Y","N","N",4,"Y","Y","N","Y","N","2020-10-25","2020-10-23"
"172","32382932","MED","32382932","PMC7203724","10.1007/s00784-020-03291-8","COVID-19: a novel coronavirus and a novel challenge for oral healthcare.","Guo J, Xie H, Liang M, Wu H.","Clin Oral Investig","6","24","2020","1432-6981; 1436-3771; ","2137-2138","brief-report; journal article","Y","Y","N","Y","N","N",8,"Y","Y","N","Y","N","2020-05-12","2020-05-07"
"173","34921266","MED","34921266","PMC8680066","10.1038/s41415-021-3724-2","Domiciliary dentistry - remote consultation and risk assessment tool.","Rollings L, Castle-Burrows C.","Br Dent J","12","231","2021","0007-0610; 1476-5373; ","741-746","research-article; journal article","Y","Y","N","Y","N","N",0,"Y","Y","N","N","N","2021-12-23","2021-12-17"
"174","34446892","MED","34446892","PMC8390057","10.1038/s41415-021-3321-4","A further plot twist: will 'long COVID' have an impact on dentistry and the dental workforce?","Agar S, Morgan E, Lee Y.","Br Dent J","4","231","2021","0007-0610; 1476-5373; ","221-224","research-article; journal article","Y","Y","N","Y","N","N",0,"Y","Y","N","Y","N","2021-08-28","2021-08-27"
"175","33795144","MED","33795144","PMC7843094","10.1016/j.identj.2021.01.012","Spanish Dentists' Awareness, Knowledge, and Practice Regarding COVID-19: A Multiple Regression Analysis.","Martínez-Beneyto Y, Ausina-Márquez V, Expósito-Delgado AJ, Ortiz-Ruiz AJ, Ibañez-Lopez FJ, Llodra-Calvo JC, Bravo M.","Int Dent J","6","71","2021","0020-6539; 1875-595x; ","530-539","research-article; journal article","Y","Y","N","Y","N","Y",4,"Y","Y","N","Y","N","2021-04-03","2021-01-28"
"176","33423578","MED","33423578","PMC7803793","10.1177/2380084420986766","Trends in Dental Medication Prescribing in Australia during the COVID-19 Pandemic.","Mian M, Teoh L, Hopcraft M.","JDR Clin Trans Res","2","6","2021","2380-0844; 2380-0852; ","145-152","research support, non-u.s. gov't; research-article; journal article","Y","Y","N","Y","N","Y",3,"Y","Y","N","Y","N","2021-01-13","2021-01-10"
"177","34148269","MED","34148269","PMC8447441","10.1111/ipd.12764","The 'new normal' in post-COVID-19 pediatric dental practice.","Maru V.","Int J Paediatr Dent","4","31","2021","0960-7439; 1365-263x; ","528-538","brief-report; journal article","Y","Y","N","Y","N","N",1,"Y","Y","N","Y","N","2021-06-22","2021-07-01"
"178","33563503","MED","33563503","PMC7867471","10.1016/j.ajodo.2020.11.030","Impact of the coronavirus disease 2019 pandemic on orthodontic patients and their attitude to orthodontic treatment.","Umeh OD, Utomi IL, Isiekwe IG, Aladenika ET.","Am J Orthod Dentofacial Orthop","5","159","2021","0889-5406; 1097-6752; ","e399-e409","research-article; journal article","Y","Y","N","Y","N","N",2,"Y","Y","N","Y","N","2021-02-11","2021-02-07"
"179","34824426","MED","34824426","PMC8614625","10.1038/s41415-021-3653-0","Undergraduate dental education: an education or training?","Bateman H, Stewart J, McCracken G, Ellis J.","Br Dent J","10","231","2021","0007-0610; 1476-5373; ","619-621","research-article; journal article","Y","Y","N","Y","N","N",0,"Y","Y","N","Y","N","2021-12-01","2021-11-25"
"180","32577830","MED","32577830","PMC7309196","10.1007/s00784-020-03413-2","Is the oral cavity relevant in SARS-CoV-2 pandemic?","Herrera D, Serrano J, Roldán S, Sanz M.","Clin Oral Investig","8","24","2020","1432-6981; 1436-3771; ","2925-2930","research-article; journal article","Y","Y","N","Y","N","N",45,"Y","Y","N","Y","N","2020-06-25","2020-06-23"
